{
  "schemaVersion": "picomoldforge.part-recipe.v1",
  "name": "spur-gear",
  "title": "Engrane recto m2 z24",
  "description": "Spur gear generated by rolling an ISO 53 basic rack on the pitch circle. The tooth profile drops along Z; the bore and keyway are drilled along Z.",
  "units": "mm",
  "axisConvention": "ISO-841",
  "template": {
    "type": "spurGear",
    "module": 2.0,
    "teeth": 24,
    "pressureAngleDeg": 20.0,
    "faceWidth": 12.0,
    "boreDiameter": 12.0,
    "keywayWidth": 4.0,
    "keywayDepth": 1.8,
    "profileShift": 0.0,
    "thicknessAllowance": 0.0
  },
  "mesh": {
    "resolutionMm": 0.12,
    "decimate": true,
    "decimateToleranceMm": 0.01
  }
}
